{
  "MetadataSpecification": {
    "URL": "https://cdn.earthdata.nasa.gov/generic/config/v0.0.1",
    "Name": "Generic-Config",
    "Version": "0.0.1"
  },
  "Generic": {
    "Name": "Data Quality Summary",
    "Version": "1.0.0"
  },
  "SubConceptType": "DQS",
  "IndexSetup" : {
    "index": {
      "number_of_shards": 3,
      "number_of_replicas": 1,
      "refresh_interval": "1s"
    }
  },
  "IndexConfiguration": {
    "IndexName": "2_generic_data_quality_summary",
    "IndexNameForRevisions": "2_all_generic_data_quality_summary_revisions"
  },
 "Indexes":
  [
    {
      "Description": "Name",
      "Field": ".Name",
      "Name": "Name",
      "Mapping": "string"
    },
    {
      "Description": "Id - This is the old ECHO 10 GUID.",
      "Field": ".Id",
      "Name": "Id",
      "Mapping": "string"
    }
  ]
}
