{
  "MetadataSpecification": {
    "URL": "https://cdn.earthdata.nasa.gov/generic/config/v0.0.1",
    "Name": "Generic-Config",
    "Version": "0.0.1"
  },
  "Generic": {
    "Name": "Citation Draft",
    "Version": "1.0.0"
  },
  "SubConceptType": "CITD",
  "IndexSetup" : {
    "index": {
      "number_of_shards": 3,
      "number_of_replicas": 1,
      "refresh_interval": "1s"
    }
  },
  "IndexConfiguration": {
    "IndexName": "2_generic_citation_draft",
    "IndexNameForRevisions": "2_all_generic_citation_draft_revisions"
  },

  "Indexes":
  [
    {
      "Description": "Draft Citation Short Name",
      "Field": ".Name",
      "Name": "name",
      "Mapping": "string"
    }
  ]
}
