{
  "MetadataSpecification": {
    "URL": "https://cdn.earthdata.nasa.gov/generic/config/v0.0.1",
    "Name": "Generic-Config",
    "Version": "0.0.1"
  },
  "Generic": {
    "Name": "Order Option",
    "Version": "1.0.0"
  },
  "SubConceptType": "OO",
  "IndexConfiguration": {
    "IndexName": "2_generic_order_option",
    "IndexNameForRevisions": "2_all_generic_order_option_revisions"
  },
  "Indexes":
  [
    {
      "Description": "Name",
      "Field": ".Name",
      "Name": "Name",
      "Mapping": "string"
    }, {
      "Description": "Id - This is the old ECHO 10 GUID.",
      "Field": ".Id",
      "Name": "Id",
      "Mapping": "string"
    }
  ]
}
