{
  "MetadataSpecification": {
    "URL": "https://cdn.earthdata.nasa.gov/generic/config/v0.0.1",
    "Name": "Generic-Config",
    "Version": "0.0.1"
  },
  "Generic": {
    "Name": "Visualization",
    "Version": "1.2.0"
  },
  "SubConceptType": "VIS",
  "IndexSetup" : {
    "index": {
      "number_of_shards": 1,
      "number_of_replicas": 1,
      "refresh_interval": "1s"
    }
  },
  "IndexConfiguration": {
    "AllowAppending": true,
    "AdditionalKeywords": ["Identifier"]
  },
  "Indexes":
  [
    {
      "Description": "Identifier as Id",
      "Field": ".Identifier",
      "Name": "Id",
      "Mapping": "string"
    },
    {
      "Description": "Identifier as Identifier",
      "Field": ".Identifier",
      "Name": "Identifier",
      "Mapping": "string"
    },
    {
      "Description": "Schema Name as the Name field",
      "Field": ".Name",
      "Name": "Name",
      "Mapping": "string"
    },
    {
      "Description": "Schema Title as the Title field",
      "Field": ".Title",
      "Name": "Title",
      "Mapping": "string"
    },
    {
      "Description": "VisualizationType",
      "Field": ".VisualizationType",
      "Name": "Visualization-Type",
      "Mapping": "string"
    },
    {    
      "Description": "Concept IDs of the source material for the Visualization",
      "Field": ".ConceptIds",
      "Name": "Concept-Ids",
      "Mapping": "token",
      "Indexer": "simple-array-field",
      "Configuration": {"sub-fields": ["Value", "ShortName"]}
    },
    {    
      "Description": "Concept IDs of the source material for the Visualization to be included in the Keyword.",
      "Field": ".ConceptIds",
      "Name": "keyword",
      "Mapping": "token",
      "Indexer": "simple-array-field",
      "Configuration": {"sub-fields": ["Value"]}
    },
    {
      "Description": "Best Available External Identifier in keywords",
      "Field": ".Specification.ProductIdentification.BestAvailableExternalIdentifier",
      "Name": "keyword",
      "Mapping": "token"
    }
  ]
}
